What are my sales in 2022 compared to 2021?	Account, Year
Which entity is driving my sales growth in 2022 compared to 2021?	Account, Entity, Year
Is there any seasonality in my sales?	Account, Year, Period
Which department is driving my expenses in 2022 compared to 2021?	Account, Department, Year
Which department spent the most in 2022 compared to 2021?	Account, Department, Year
For which vendors did my spend increase for from 2021 to 2022	Account, Vendor, Year
What was my labor spend in 2022 compared to 2021	Account, Year
What were my top 3 biggest expense in 2021 compared to 2022	Account, Year
How did my sales vary accross offices in 2021 compared to 2022	Account, Entity, Year
How did my sales vary accross entities in 2021 compared to 2022	Account, Entity, Year
How close were we to our Revenue target in 2021 compared to 2022	Account, Scenario, Year
How close were we to our Budget target in 2021 compared to 2023	Account, Scenario, Year
Which month was my highest for sales in 2021	Account, Period, Year
Which month was my lowest for sales in 2021	Account, Period, Year
Are we on track to hit our Revenue target for this Year	Account, Period, Year, Period
Are we on track to hit our Revenue target for this Month	Account, Period, Year, Period
Are we going over budget this Month?	Account, Period, Year, Period
What are my COGS in 2022 compared to 2021?	Account, Year
What did we spend on goods in 2022 compared to 2021?	Account, Year
What did we spend on products in 2022 compared to 2021?	Account, Year
How liquid were we in 2021 compared to 2022	Account, Year
How solvent were we in 2021 compared to 2022	Account, Year
How profitable were we in 2021 compared to 2022	Account, Year
How efficient were we in 2021 compared to 2022	Account, Year
Is there any seasonality in my cash?	Account, Year, Period
What are my biggest expenses this year?	Account, Year
What are the biggest expenses for New York and Chicago	Account, Entity, Year
Who are my most profitable customers this year?	Account, Customer, Year
What trends are there in my operating expenses?	Account, Year, Period
Which products are showing the highest growth?	Account, Product, Year, Period